{
  "aead": "AES-256-GCM",
  "class": "golden-interop",
  "expected": {
    "auth_plaintext": {
      "client_auth": "00090020acdcc8494d458f44a7aaac1d6a84ec624daee88436db2ae26e67ba645a106228000a0042080712ccb4f316318b7e6daee91b15e38c6217b5c2cde0c7a5eba8048c6974e40fdd2e768c3881416eecc3d3c3f42975bc0e6ca318a384aaefdf6ab5f2869c16bc04000b0020647142ade665ade076975c7fc111853bfd23143c368c5f69cc0d0c9ab1153b78",
      "server_auth": "000900208146640f02493af4fbc54fe33388e75dc2c937ae0b7727cc2b2afb1b75199a3e000a004208079c276d2e20a2fea83cfb0c3a08c42311e67b218e0c6b6fae669f8299990917ba3f49d7bc470c39615a0c3affd67a0be36399d420ce41d56a0832912db5bfbe06000b002082b1c8f42b08d9b0a162e91729a625a4a93b7d0e74a168597d47f4f5d1e11213"
    },
    "cert_verify": {
      "client": "080712ccb4f316318b7e6daee91b15e38c6217b5c2cde0c7a5eba8048c6974e40fdd2e768c3881416eecc3d3c3f42975bc0e6ca318a384aaefdf6ab5f2869c16bc04",
      "server": "08079c276d2e20a2fea83cfb0c3a08c42311e67b218e0c6b6fae669f8299990917ba3f49d7bc470c39615a0c3affd67a0be36399d420ce41d56a0832912db5bfbe06"
    },
    "finished": {
      "client": "647142ade665ade076975c7fc111853bfd23143c368c5f69cc0d0c9ab1153b78",
      "server": "82b1c8f42b08d9b0a162e91729a625a4a93b7d0e74a168597d47f4f5d1e11213"
    },
    "finished_keys": {
      "client": "0cd8d16d9798de00568d11ca7066fda6dcc93a81e9dfb1fd7aa97af1e7c434a6",
      "server": "cebfd4567c0aea393368d8d2e6912261465f77f9fbaa2eacb66f186b0ed6fbcc"
    },
    "frames": {
      "client_auth": "4e50414d220103000000000000000000000000009eb18000570000000000000000000000ea215d113056b369c5f4847d72ae42c4e48b0d705682fe891274d9619eca4305d94df6129bec16399fb6dc49902600a4c0eae8f8d13bfdc9abf8205cb6f683fab8b7098494c23957d84a5183f93dc922c9a301030d3f0be58a34bfc1be20d3822ba0cdb452481b96ad102ba693f7bab937ed00b2660058d3e9f28c8917d339c30be72a1104acee9414dcb57275deabf89be8bf5bf38481e42ebf500c9b0a",
      "client_hello": "4e50414d20010000000000000000000000000004db9cdad796000000000000000000000000010001010003000211ec000500020807000c00020001000704c028c793778741b80b02b4339f2aa4347255b099f17264e1b8cc0a2c7c2a1a79f7997b907fd0496c6e6c8ad7714f5f339d75f11f625591a869be1175ae47f05fd4313468232ba6957d7807b824f445ac99a0d568ab1ad54dca8249d1482e61275f52248c77f61a4248753188cd1794cd0a465ec0dc4b025985c461b74e76286e4c37e77405695cc9fd0654374b427a20343aec0ff1a187768273bfc4905472a1da387f14559d6ce87313f6a5b6138434539f9a13684055b177e543f8b40f432abd7cc49989a50a9084c660913f45a8593b17499bc4cf936c2bc1851421cb986808a0ef30afe97aab5b8b8eb3f0b3506a95b91563a0e57db7231044987ef141bdab3537c316ad16f17805a81f29329879a94e96157e4b7447f7d59603b21bd896cc47b7cd4e232322eb9c5d2215696bcffca3a04efcc4c5d9cc39ac9a6e8700d38c244b0169e7fa1fe81b4b10365e74e6a1f7f756d11acdc84043f81006d62995376c22535958feb53f78117ee0f61c4c862640d06dc57a2b8be62a41a642af3bc63f6bac98bbbbff70570f37b8f8d9572f2735657a6c98f96caf57a849868720b2640b8bb2732237a1f984c18872d10289ce43c952c9257e06529aeb76afd127b17596fd25c5216c9cabd9b18efc50e87bbb04568bb7d5c4e9288c006483af5912e19108573700bd10cd77224b80659ea75aa74270b33ac4008b738bfee271e78658c8742ff13c96ad0781a03c7576ca26dd58b52980ba58c0505e446afa140cdcea0490db1f9b18815d4314b2459cacc562441c91f4084e5426c88e632cf7482e79907911d06473260835d7b85e7856a829aea0381707b939ce86882cc09c4448c6ae94a9c303107c5667eefb8df7763cc21189a3c590c40aa51f491503a7935ec08f4fc300cbe607ed8c9100c29fbf45584b13c8d780069337aec76c36ceb70373e2ab6e7b934b466f53fb32eaf040055496b8540e23a2a277e534468608d5ec0f8d38cea5bbb806c1bf4f164f6ac826fe733f95461e29dcc11200c0aada1b8332023eab329718ce25cc0a09555903f3578bbc863b1752ca94365da556df54c3b7e05cbb7115fbc1b6c57a172c31b9906560c8fb54f3c563a2256cc073243b8179b4a28d60e086cf51082ee429272996f0aabe03ba0eafd3c8e7d954bd0933e2f60ed0c32cede7b820a28e48f3ca3c40913cccae2337abfc59843f08c9863325d65a4e9e15c1f46172b118b2b5eb0f1d5158a00134f27b085488c3a0621fe4e5678698250fb74ee5152e3e35a66544a05d279ea99131fbc15165060b90f88eeb7b20892a4de4cb1683495bd7da037966b47cc040f1764c5deb06b5499d4267391cebbb47f734d8539e39528436a1858182854bf20b1f93279afb706464c65ccc5ae099b37cc03556c26abf4c3f8b9ba3a936707211a49a59b268f5284f7970c77612719450377417428c4ba47c9ca115cf95304c4759c5d8859b44985c06a6c924689237ba320d610960d61c53e85431789e67a40113f167ff93429c264f6cabc95448c903437d39a6577be0cf0012852aa476351a9046a110a1a625a3d74c910b78bce9cfca735e4f91b8a4c57dbe489e849446098aacf73070aee638fcc8896473d3c159d3afb4b687b40dfbf371a9c2644b605187b71a14bc4c8678fe82478520f0098930a754748b7ddcb43ef75a0dbf3a0d26381af4eba4a98eaa9b4e6a",
      "server_auth": "4e50414d220102000000000000000000000000009ed60efd56000000000000000000000081e6c309c814402e942af881251bcfbd56dc467fbe5e4decbae777f79ab4dcc484b705c27484c5aa6955fff95a6f43919d4f2d1237fb83af8775d944ebdeed89d680a66ec49532f4b81d4208f274935e8a8a154cb859a472dd29f7da95c66724965e79f61c1a6ce1f583dc9fd3f47f47d97f15969e53848aa7d5b0e5bed4041f7cca03bb0a221f4a8cb4acdcd47e00a394fe4db42222656cc66fb56c7ad2",
      "server_hello": "4e50414d200101000000000000000000000000047b591f9f31000000000000000000000000020001010004000211ec000600020807000d000200010008046099a820014c16bef55199dc75ae625229fa35e970b65452734c41a22ef11dfd4930c02b700622211749af712b01ead01e96e3eadcc5202da6afee273d48f980a6cb52f0738df98e0cb07b6407bf65015369ce5cfef9476054b616f6b4f42a802f609060062c7b0c8929c6a3fcff2dce1157ab75debcd6ba2775116270d88ee740265745eada0e21d3db81bdea820597cd735a5b78726fb3445f53c81ec117e5a280ea37a1cdecd016ab5f05fd7b2902f0a60e64433913f9eec85e9a1c798e184ddc8c4a18b132aad84deaaab8719838e25c31e6bec4a05eb9b3ecddb543a636e653f090f5f913bbd608db10f0a511f628ec2d2ebbfc25b0594fd5b9a08904c8746b73543bd49853885cc927dd778724891e9c30c392adaa577388ffea41e70c99ed8413917dd6defa42a71fb6408f9578b1d35fd9a28ad6c14e3f566373c7e7027c514ff9434bf62f303d29eb8d82b89fbc4a192bd105cd336542f4ebd129325e9e7d6f111f26dd19cbb955e2e82631a9334e9dddcaef710de4c1068485eb23c604c65e4be9d260f0538accf09243546bc3f59cf2d0ae88bae6106c454d5fc54ddd29c1b276538b7f47eff6f543b247100c8b7ddc92759ae32b4ee5c39b370591ec5b143909b15862e7e5a3f3bc850764b43b522d4829dd4cd51cbfb79f59dc512e2d364b32410e11d7c5293bf6c6067e7a854ec1d9fcd5d5333952815d5d04c6c38bb0650472483a78449cb14c5c70962d1f09f7da4bab3a426ba9e63d533f34209e15411202ca2dca969d0f70a99347c03fca010d1551f9e5a7b2a272e5e4a4e9d9a419b608ec44d8bcd5f5131a4dbd2b30634c9f359f729283f6ef69896534d786042087f7a5746072299e4fed6f2e785457a1bed05004f945285f086e38bc6cc998de09ceef5cbe05038fc47ef342f713dccd0839294063c77634af9a3df2c8129048e3eed17362c9c4d9dcc8262170697ab29268b3ef035592303cd293ebb8470f8e0145e543322446ad7b7da3042ad9758f2cabd7a14b6e811806655a3ecc4a079fc076e25a997d78f1d5ebcba6209e800247757e8f02f73365095e2d063be4e88c9a3a341bfaf0194902eec85cf1fa7727d8dd9232925dd60d29f98722fdc696d3b2dc2b40467b68fe4897b11c4e366f4b957d0c98a1b04aad7f286b68bd803eda0b4e5399da53cccfb92428e1628e5fb758fdea2b9304dfd923c7d6bf2b5f0c45d43e41295ee692203ce5b8dc51a5c804e394784e027ebe1ba52fc64879807585c28a3ebbc4e15ef1eee5ac15c4eba1fed2d6cc9c3acb41caf7f8ef544b5de779c5627831189e71b0d4cd638b52080d1e599e1917ee2c1f181cb1ed6cec1fc188424e236b8d6841cab01d9f31f7f0470d26fa5c21eda25465f8f521245606c0d4557ac669092a2367fa09c4a30e0dfffb98efdd9978bbd8b8f44a0a2d0e8408d2404468a499e47620fb3466541b4c87321c4232715b3905eaa3b829e1697440b7b909e3afeb0c0bd09f79641e08189009c70971f2be56f94499a11bdbde9edb7d7b7dc1b4d35b61c2ece435373f8343c85b78674dadfc7e146f882b4f"
    },
    "kem": {
      "kem_ciphertext": "99a820014c16bef55199dc75ae625229fa35e970b65452734c41a22ef11dfd4930c02b700622211749af712b01ead01e96e3eadcc5202da6afee273d48f980a6cb52f0738df98e0cb07b6407bf65015369ce5cfef9476054b616f6b4f42a802f609060062c7b0c8929c6a3fcff2dce1157ab75debcd6ba2775116270d88ee740265745eada0e21d3db81bdea820597cd735a5b78726fb3445f53c81ec117e5a280ea37a1cdecd016ab5f05fd7b2902f0a60e64433913f9eec85e9a1c798e184ddc8c4a18b132aad84deaaab8719838e25c31e6bec4a05eb9b3ecddb543a636e653f090f5f913bbd608db10f0a511f628ec2d2ebbfc25b0594fd5b9a08904c8746b73543bd49853885cc927dd778724891e9c30c392adaa577388ffea41e70c99ed8413917dd6defa42a71fb6408f9578b1d35fd9a28ad6c14e3f566373c7e7027c514ff9434bf62f303d29eb8d82b89fbc4a192bd105cd336542f4ebd129325e9e7d6f111f26dd19cbb955e2e82631a9334e9dddcaef710de4c1068485eb23c604c65e4be9d260f0538accf09243546bc3f59cf2d0ae88bae6106c454d5fc54ddd29c1b276538b7f47eff6f543b247100c8b7ddc92759ae32b4ee5c39b370591ec5b143909b15862e7e5a3f3bc850764b43b522d4829dd4cd51cbfb79f59dc512e2d364b32410e11d7c5293bf6c6067e7a854ec1d9fcd5d5333952815d5d04c6c38bb0650472483a78449cb14c5c70962d1f09f7da4bab3a426ba9e63d533f34209e15411202ca2dca969d0f70a99347c03fca010d1551f9e5a7b2a272e5e4a4e9d9a419b608ec44d8bcd5f5131a4dbd2b30634c9f359f729283f6ef69896534d786042087f7a5746072299e4fed6f2e785457a1bed05004f945285f086e38bc6cc998de09ceef5cbe05038fc47ef342f713dccd0839294063c77634af9a3df2c8129048e3eed17362c9c4d9dcc8262170697ab29268b3ef035592303cd293ebb8470f8e0145e543322446ad7b7da3042ad9758f2cabd7a14b6e811806655a3ecc4a079fc076e25a997d78f1d5ebcba6209e800247757e8f02f73365095e2d063be4e88c9a3a341bfaf0194902eec85cf1fa7727d8dd9232925dd60d29f98722fdc696d3b2dc2b40467b68fe4897b11c4e366f4b957d0c98a1b04aad7f286b68bd803eda0b4e5399da53cccfb92428e1628e5fb758fdea2b9304dfd923c7d6bf2b5f0c45d43e41295ee692203ce5b8dc51a5c804e394784e027ebe1ba52fc64879807585c28a3ebbc4e15ef1eee5ac15c4eba1fed2d6cc9c3acb41caf7f8ef544b5de779c5627831189e71b0d4cd638b52080d1e599e1917ee2c1f181cb1ed6cec1fc188424e236b8d6841cab01d9f31f7f0470d26fa5c21eda25465f8f521245606c0d4557ac669092a2367fa09c4a30e0dfffb98efdd9978bbd8b8f44a0a2d0e8408d2404468a499e47620fb3466541b4c87321c4232715b3905eaa3b829e1697440b7b909e3afeb0c0bd09f79641e08189009c70971f2be56f94499a11bdbde9edb7d7b7dc1b4d35b61c2ece435373f8343c85b78674dadfc7e146f882b4f",